prefix	name	homepage	description
NRO	NeuralReprogrammingOntology		The neural reprogramming ontology encompasses the domain of neural regenerative cell reprogramming knowledge. As research progresses, researchers and specialists in the field of reprogramming could continue to expand the bounds of this foundation, so adding to its depth.
NTIY	nexus_test		
NXDX	Test NXDX		A test for ontology submission
O-REXTECH	OSIRIS-REx Analytical Technique		second draft, M4M workshop, testing SKOS-Play and workflows. Add top concepts and more hierarchy.
OBI_BCGO	Beta Cell Genomics Ontology	https://github.com/obi-bcgo/bcgo	Beta Cell Genomics Ontology (BCGO) is an application ontology built for the Beta Cell Genomics database (http://genomics.betacell.org/gbco/) aiming to support database annotation, complicated semantic queries, and automated cell type classification. The ontology is developed using Basic Formal Ontology (BFO) as upper ontology, Ontology for Biomedical Investigations (OBI) as ontology framework and integrated subsets of multiple OBO Foundry (candidate) ontologies. Current the BCGO contains 2383 classes including terms referencing to 24 various OBO Foundry ontologies including CL, CLO, UBERON, GO, PRO, UO, etc.
OBI_IEE	The Ontology for Biomedical Investigation based Inner Ear Electrophysiology		Inner Ear Electrophysiology (IEE) is an application ontology created to describe electrophysiology and biophysical data collections of the anatomical entities and cells (e.g., outer hair cells) of the inner ear. The ontology is developed with The Ontology for Biomedical Investigations (OBI) and integrated subsets of multiple OBO ontologies, especially, PATO, FMA, CHEBI, and OBA.
OBIWS	Bioinformatics Web Service Ontology		
OBOE	The Extensible Observation Ontology	https://github.com/NCEAS/oboe	The Extensible Observation Ontology (OBOE) is a formal ontology for capturing the semantics of scientific observation and measurement. The ontology supports researchers to add detailed semantic annotations to scientific data, thereby clarifying the inherent meaning of scientific observations. The main concepts in OBOE include: - Observation: an event in which one or more measurements are taken - Measurement: the measured value of a property for a specific object or phenomenon (e.g., 3.2) - Entity: an object or phenomenon on which measurements are made (e.g., Quercus rubrum) - Characteristic: the property being measured (e.g., VolumetricDensity) - Standard: units and controlled vocabularies for interpreting measured values (e.g., g/cm^3) - Protocol: the procedures followed to obtain measurements (e.g., DensityProtocol2014) OBOE can characterize the context of an observation (e.g., space and time), as well as dependencies such as nested experimental observations. It includes an extensive set of unit definitions (e.g., grams of carbon per liter of seawater), and can facilitate automatic unit conversions (e.g., pounds to kilograms). OBOE can be easily extended to create Entities and Characteristics for specific research domains, making it both broadly applicable and highly customizable. OBOE is being used to improve data interpretation, facilitate reuse, and create precise and effective systems for data search and discovery.
OBOE-SBC	Santa Barbara Coastal Observation Ontology	https://semtools.ecoinformatics.org/	Extensible Observation Ontology for the Santa Barbara Coastal Long Term Ecological Research project (SBC-LTER). OBOE SBC extends core concepts defined in the OBOE suite that are particular to the Santa Barbara Coastal Long Term Ecological Research project's data collection activities. These include specific measurement protocols, sites, etc. This is mean as a case study ontology for the Semtools project.
OBS	OntoBioStat		Domain ontology for covariate selection support knowledge based.
OCD	OCD ontology		
OCDM	Ontology of Craniofacial Development and Malformation	https://www.facebase.org/ocdm/	The Ontology of Craniofacial Development and Malformation (OCDM) is a mechanism for representing knowledge about craniofacial development and malformation, and for using that knowledge to facilitate integrating craniofacial data obtained via multiple techniques from multiple labs and at multiple levels of granularity. The OCDM is a project of the NIDCR-sponsored FaceBase Consortium, whose goal is to promote and enable research into the genetic and epigenetic causes of specific craniofacial abnormalities through the provision of publicly accessible, integrated craniofacial data.
OCE	Ontology of Chemical Elements	https://github.com/ontologyofchemicalelements/OCE	The Ontology of Chemical Elements (OCE) is a community-based ontology in the domain of chemical elements. OCE systematically represents and annotates the known 118 chemical elements and their charactistics and relations with other entities. OCE imports the basic chemical element information from ChEBI and adds more classes, annotations, and axioms. OCE specifically focuses on adding all the related information from the Periodic Table of Chemical Elements.
OCHV	Ontology of Consumer Health Vocabulary		
OCIMIDO	Ocular Immune-Mediated Inflammatory Diseases Ontology	https://github.com/sap218/ocimido	Application ontology for Ocular Immune-mediated Inflammatory Diseases, built from domain experts in ophthalmology, clinical guidelines, and enhanced with patient-preferred terms.
OCMR	Ontology of Chinese Medicine for Rheumatism	https://github.com/biomedontology/ocmr	OCMR is a biomedical ontology that represents anti-rheumatism traditional Chinese medicines and related information.
OCRE	Ontology of Clinical Research	http://rctbank.ucsf.edu/home/ocre	OCRe is an ontology designed to support systematic description of, and interoperable queries on, human studies and study elements.
OCVDAE	Ontology of Cardiovascular Drug Adverse Events		OCVDAE is a biomedical ontology of cardiovascular disease drug-associated adverse events
ODAE	Ontology of Drug Adverse Events	https://github.com/ODAE-ontology/ODAE	The Ontology of Drug Adverse Events (ODAE) is a biomedical ontology in the area of drug adverse events, developed by following OBO Foundry principles (e.g., openness, collaboration).
ODHT	Digital Health Technologies		
ODNAE	Ontology of Drug Neuropathy Adverse Events	https://github.com/odnae/odnae	ODNAE is an extension of OAE with a focus on drug-associated neuropathy adverse events.
OF	OntoFood		This is an ontology with SWRL rules of nutrition for diabetic patient. We can import the value of Blood Sugar and Weight by .xls and use that like instance for generate the rules with rule engine Jess.
OFSMR	Open Predictive Microbiology Ontology	https://sites.google.com/site/openfsmr/open-fsmr-detailfilter	Food-matrix ontology for Open Food Safety Model Repository
OGDI	Ontology for Genetic Disease Investigations		
OGG-MM	Ontology of Genes and Genomes - Mouse		
OGMD	Ontology of Glucose Metabolism Disorder	http://sourceforge.net/projects/ogmd/	Including the disease names. phenotypes and their classifications involved in Glucose Metabolism Disorder, Diabetes. (OBO and OWL format are available in sourceforge.) OWL file is downloadable as the different view here.
OGR	Ontology of Geographical Region		This OWL ontology classified the geograhical regions related vocabularies extracted from UMLS. It used with other ontologies to represent the genetic susceptibility factors of diabetes.
OGROUP	Orthologous Group Ontology		Ontology to help prossessing the information from orthologous groups in order to infer new functional annotations. The ontology integrates definitions from diverse ontologies.
OLAM	Ontology of Laboratory Animal Medicine		
OMV	Ontology Metadata Vocabulary	http://omv2.sourceforge.net/index.html	A standard for ontology metadata; a vocabulary of terms and definitions describing ontologies which specifies reusability-enhancing ontology features for human and machine processing purposes.
ONL-DP	Dataset processing	http://neurolog.unice.fr/ontoneurolog/v3.0/Documentation_OntoNeuroLOGv3.pdf	This ontology is a module of the OntoNeuroLOG ontology, developed in the context of the NeuroLOG project, a french project supported by ANR (ANR-06-TLOG-024 grant) aiming at integrating distributed heterogeous resources in neuroimaging. If covers the domain of Datasets and the processing of datasets. It includes a detailed taxonomy of datasets in the area of neuroimaging (and especially MR imaging) as well as a taxonomy of medical image processing.
ONL-MR-DA	Magnetic Resonance Dataset Acquisition Ontology	http://neurolog.unice.fr/ontoneurolog/v3.0/Documentation_OntoNeuroLOGv3.pdf	This ontology is a module of the OntoNeuroLOG ontology, developed in the context of the NeuroLOG project, a french project supported by ANR (ANR-06-TLOG-024 grant) aiming at integrating distributed heterogeneous resources in neuroimaging. If covers the domain of Magnetic Resonance Imaging (MRI) dataset acquisition, i.e. MRI protocols, and MRI sequence parameters. In particular, it includes a multi-axial classification of MR sequences.
ONL-MSA	Mental State Assessment	http://neurolog.unice.fr/ontoneurolog/v3.0/Documentation_OntoNeuroLOGv3.pdf	This ontology is a module of the OntoNeuroLOG ontology, developed in the context of the NeuroLOG project, a french project supported by ANR (ANR-06-TLOG-024 grant) aiming at integrating distributed heterogeous resources in neuroimaging. This MSA ontology module covers the field of mental state assessments, i.e. instruments, instrument variables, assessments, and resulting scores. It includes a generic domain core ontology, that provides a general model of such entities and a general taxonomy of behavioural, neurosychological and neuroclinical instruments, that can be easily extended to model any particular kind of instrument. It also includes such extensions for 8 relatively standard instruments, namely: (1) the Beck-depression-inventory-(BDI-II), (2) the Expanded-Disability-Status-Scale, (3) the Controlled-oral-word-association-test, (4) the Free-and-Cued-Selective-Reminding-Test-with-Immediate-Recall-16-item-version-(The-Gröber-and-Buschke-test), (5) the Mini-Mental-State, (6) the Stroop-color-and-word-test, (7) the Trail-making-test-(TMT), (8) the Wechsler-Adult-Intelligence-Scale-third-edition, (9) the Clinical-Dementia-Rating-scale, (10) the Category-verbal-fluency, (11) the Rey-Osterrieth-Complex-Figure-Test-(CFT).
ONL-TASKS	Cognitive Reserves Assessment Tasks		This ontology is an extension of the OntoNeuroLOG ontology, developed in the context of a project supported by Russian Foundation for Basic Research (19-29-01017 grant). The ontology organizes tests that are used for assessing cognitive reserves with the focus on keywords that can be employed in mining of PubMed publications.
ONLIRA	Ontology of Liver for Radiology	http://vavlab.ee.boun.edu.tr/pages.php?p=research/CARERA/carera.html	ONLIRA (Ontology of the Liver for Radiology) focuses on a semantic specification of imaging observations of CT scans for the liver. ONLIRA extends RadLex with semantic relationships that describe and relate the concepts. Thus, automated processing tasks, such as identifying similar patients, are supported.
ONSTR	Ontology for Newborn Screening Follow-up and Translational Research	http://code.google.com/p/onstr/	Ontology for Newborn Screening Follow-up and Translational Research (ONSTR) is an application ontology covering the domain of newborn screening, follow-up and translational research pertaining to patients diagnosed with inheritable and congenital diseases mainly identified through newborn dried blood spot screening. ONSTR is a central component of the project Newborn Screening Follow-up Data Integration Collaborative (NBSDC). ONSTR uses the Basic Formal Ontology v2 (BFO2, v2012-07-20) as top-level ontology and extends the classes imported from OBO Foundry ontologies and candidate ontologies. For latest release notes please see: http://onstr.googlecode.com/svn/tags/currentRelease/2013-05-02/ NBSDC project page: https://nbsdc.org (under construction).
ONTOAD	Bilingual Ontology of Alzheimer's Disease and Related Diseases		OntoAD is a bilingual (English-French) domain ontology for modeling knowledge about Alzheimer's Disease and Related Syndromes.
ONTODM-ALGORITHM	OntoDM-core/algorithms		OntoDM-algorithms is an ontology for data mining and machine learning entities.
ONTODM-CORE	Ontology of Core Data Mining Entities	www.ontodm.com	OntoDM is a generic ontology for the domain of data mining. The ontology includes the information processing processes that occur in the domain of data mining, participants in the processes and their specifications. OntoDM is highly transferable and extendable due to its adherence to accepted standards, and compliance with existing ontology resources. The generality in scope allows wide number of applications of the ontology, such as semantic annotation of data mining scenarios, ontology based support for QSARs, etc.
ONTODM-KDD	Ontology of Data Mining Investigations		
ONTODT	Ontology of Datatypes	http://www.ontodt.com	This ontology contains entities such as: datatype, datatype generator, datatype qualiy and others giving the possibility to represent arbitrary complex datatypes. This is an important fact for a general data mining ontology that wants to represent and query over modelling algorithms for mining structured data. The ontology was first developed under the OntoDM (Ontology of Data Mining is available at http://kt.ijs.si/panovp/OntoDM) ontology, but for generality and reuse purpose it was decided to export it as a separate ontology. Additionaly, the OntoDT ontology is based on and ISO/IEC 11404 (http://www.iso.org/iso/catalogue_detail.htm?csnumber=39479) standard and can be reused used independently by any domain ontology that requires representation and reasoning about general purpose datatypes.
ONTOKBCF	Ontological Knowledge Base Model for Cystic Fibrosis		
ONTOLURGENCES	Emergency care ontology		Emergency care ontology build during LERUDI project. http://www.ncbi.nlm.nih.gov/pubmed/25160343 (v4.0)
ONTOMA	Ontology of Alternative Medicine, French		
ONTOPARON	Ontology of Amyotrophic Lateral Sclerosis, all modules		
ONTOPARON_SOCIAL	Ontology of amyotrophic  lateral sclerosis, social module		
ONTOPBM	Ontology for Process-Based Modeling of Dynamical Systems (OntoPBM)		OntoPBM is an ontology of core entities for process-based modeling of dynamical systems.
ONTOPNEUMO	Ontology of Pneumology		Ontology of pneumology (french version). The ONTOPNEUMO ontology was developped by Audrey Baneyx, under the direction of Jean Charlet about knowledge engineering expertise and by François-Xavier Blanc in collaboration with Bruno Housset about medical expertise. The OWL compliant ONTOPNEUMO ontology is available under Creative Commons license “Attribution-Non-Commercial-No Derivative Works 2.0 UK”. Details of this license are accessible at : http://creativecommons.org/licenses/ by-nc-nd/2.0/uk/.
ONTOPSYCHIA	OntoPsychia, social module		
ONTOREPLICOV	OntoRepliCov		OntoRepliCov is an ontology designed to describe the different stages of the SARS-CoV-2 replication process.
ONTOSIM	The Ontology of Information System on Mortality		
ONTOSINASC	Ontology of Information System on Live Births		[pt] A Ontologia do SINASC foi desenvolvida no contexto do projeto DIASUS. Ela buscou resgatar a estrutura presente na ficha de preenchimento da Declaração de Nascido Vivo - DN, do Sistema de Informação de Nascidos Vivos - SINASC, do Sistema Único de Saúde, do Brasil. [en] The SINASC Ontology was developed in the context of DIASUS project. This ontology intent to rescue the data structure presented in Live Birth Certificate form, from Information System on Live Births - SINASC, from Brazilian Public Health System - SUS.
ONTOTOX	Chemotherapy Toxicities Ontology	https://github.com/TeamHeka/OntoTox	OntoTox is an ontology designed to represent chemotherapy toxicities extracted from various data in Clinical Data Warehouses. OntoTox can integrate toxicities and grading information extracted from heterogeneous sources. Examples of OntoTox instantiations can be found in GitHub : https://github.com/TeamHeka/OntoTox
ONTOTOXNUC	Ontology of Nuclear Toxicity		Ontology of nuclear toxicity developed during ToxNuc project <>.
OntoVIP	Medical image simulation	http://vip.creatis.insa-lyon.fr/ontovip/v1.0/Documentation_OntoVIPv1.pdf	The OntoVIP ontology was developed in the context of the Virtual Imaging Platform project (VIP), a french project supported by ANR (ANR-09-COSI-03 grant) aiming at sharing medical image simulation resources. This ontology describes the content of the models used in medical image simulation. This ontology can be used to annotate such models in order to highlight the different entities that are present in the 3D scene to be imaged, i.e. anatomical structures, pathological structures, foreign bodies, contrast agents etc. The model allows also to associate to these entities information about their physical qualities, which are used in the medical image simulation process (to mimick physical phenomena involved in CT, MR, US and PET imaging). This ontology partly relies on the OntoNeuroLOG ontology (ONL-DP ONL-MR-DA), as well as PATO, RadLex, FMA and ChEBI.
OOEVV	Ontology of Experimental Variables and Values	http://bmkeg.isi.edu	The ontology of experimental variables and values provides a lightweight representation of (a) the variables used to measure experimental properties and (b) the measurement scales that form the complex data types supporting that data. Many different variables measure the same thing, here we use a lightweight representation driven by a small number of classes and a large number of variables to focus only on providing a vocabulary of variables that may be extended for consolidation to standardized variables for specific things and functions to map between values from different measurements scales. We use the base ontology description to provide a very lightweight representation of the basic elements of an experimental design and we use views to instantiate it for specific domains.
OPD-NAMBOBI	SELECTED OTHER PRIORITY DISEASES UNDER IDSR (INTEGRATED DISEASE SURVEILLANCE AND RESPONSES)		"Objective:		To	report cases of notifiable diseases, other diseases of	public health importance."
OPDE	OPD-Ethiopia		
OPDRE	OPD Regitry Ethiopia		
OPDRONT	OPD Register Ontology		Vocabulary creation for OPD Register: MINISTRY OF HEALTH AND CHILD CARE
OPDT	opd_test		opd test for group 2
OPDZIMBABWE	OPDZimbabwe		OPD Terms that are used in Zimbabwe.
OPE	Ontology of Physical Exercises		The Ontology of Physical Exercises (OPE) provides a reference for describing an exercise in terms of functional movements, engaged musculoskeletal system parts, related equipment or monitoring devices, intended health outcomes, as well as target ailments for which the exercise might be employed as a treatment or preventative measure.
OPMO	Open Provenance Model		
OPTIMAL	OPTImAL: An ontology for patient adherence modeling in physical activity domain		OPTImAL is a reusable formal model of factors affecting CVD patient adherence to physical activity and exercise. The basis for this model relies on the analysis of data/evidence published in the scientific literature and enables identification of adherence based on the patient profile. In the model, the patient profile is seen from the perspective of 60 multidimensional aspects (320 factors). Each factor is associated with defined adherence to a particular patient activity behavior.
OPTION-ONTOLOGY	Optimization Algorithm Benchmarking Ontology		OPTImization Algorithm Benchmarking ONtology
ORCS	Ontology for Representing CDM Semantics	https://github.com/ufbmi/ORCS	The Ontology for Representing CDM Semantics (ORCS) is an application ontology that was developed to transform common-data-model-based data into ontologically-based data such as RDF, RDF*, OWL2, or Referent Tracking tuples. Although initially developed for such transformations of PCORnet Common Data Model (CDM) based data, ongoing and future work involves other CDMs such as OMOP.
OREX-SAM	OSIRIS-REx sample type		Sample types from JSC-SAMIS Interface Control Document. Edited by S.M. Richard. These sample types are limited to those expected from the OSIRIS-REx sample return, this is not an exhaustive sample type categorization.
OREX-WG	OSIRIS-REx sample analysis workgroups		Workgroups organized to analyzed samples returned by OSIRIS-REx mission from asteroid Bennu. Mostly for reference in other metadata records.
OSM	Ontologia de Saúde Mental	https://saudeconectada.org/	Esta ontologia foi desenvolvida para auxiliar na gestão da Rede de Atenção Psicossocial no contexto brasileiro, a fim de possibilitar a criação de ferramentas computacionais inteligentes, permitindo a integração e interoperabilidade entre bases de dados independentes e possibilitando a geração de indicadores para a saúde mental, visando melhorar a tomada de decisão, o planejamento e a eficiência e eficácia dos serviços prestados à comunidade.
PACO	Physical Activity Ontology		Physical Activity Concept Ontology (PACO) contains various concepts that are required to describe one's physical activity.
PAE	Plant Anatomy	http://www.plantontology.org	REPLACED BY: Plant Ontology (PO). A controlled vocabulary of plant morphological and anatomical structures representing organs, tissues, cell types, and their biological relationships based on spatial and developmental organization. Note that this has been subsumed into the PO. This file is created by filtering plant_ontology_assert.obo to contain only terms from the plant anatomical entity branch of the PO. For more information, please see: http://palea.cgrb.oregonstate.edu/viewsvn/Poc/tags/live/
PANDA	Probabilistic Knowledge Assembly Ontology		Probabilistic Knowledge Assembly (PANDA) Ontology has been developed in the context of the DARPA's Big Mechanism research program. It provides a semantic interface for capturing information on molecular interactions extracted from scientific texts.
PANET	PaN Experimental technique		
PARTUMDO	postpartum depression ontology		This ontology is for use in extracting postpartum depression condition codes, and also comorbidities and diseases often mistaken for postpartum depression. The ontology describes not only the codes but also the relationships between these various diseases/risk factors for use in automatically extracting relevant patient populations from Electronic Health Records
PATCT	Placental Cell Type		Cell types associated with placental structure and function. This Cell Type ontology builds on the Cell Ontology (CL) as well as the BRENDA Tissue and Enzyme Source Ontology (BTO) and was further developed by PAT External Scientific Panel Members and contributions from other subject matter experts.
PATEL	Archana Patel		Covid19 Impact on Banking Ontology (Covid19-IBO) provides semantic information about the impact of the Covid-19 on the banking sector of India
PATGV	Placental Genetic Variance		Includes variations of DNA sequence, chromosomal structure and copy number, as well as RNA and translational variation. The Genetic Variation ontology expands on work done for Variation Ontology (VariO) and Sequence Types and Features Ontology (SO) which can be found on NCBO. This ontology was further developed by PAT External Scientific Panel Members and contributions from other subject matter experts.
PATHLEX	Anatomic Pathology Lexicon		PathLex, a comprehensive lexicon—a unified language of anatomic pathology terms—for standardized indexing and retrieval of anatomic pathology information resources.
PATIT	Placental Investigative Technique		Experimental methods and observation types used in placental research. The PAT Investigative Techniques ontology builds on work done for a handful of existing ontologies, including the Ontology for Biomedical Investigations (OBI) and NCI Thesaurus (NCIT), and was further developed by PAT External Scientific Panel Members and contributions from other subject matter experts.
PATMHC	Placental Maternal Health Conditions		Physical and psychological disorders in the mother that occur during pregnancy, childbirth, and the postpartum period. These include both pre-existing and gestational maternal health conditions that may result in adverse pregnancy outcomes. The Maternal Conditions Ontology builds on the work done for a handful of existing ontologies, including the Human Phenotype Ontology (HPO) and NCI Thesaurus (NCIT), and was further developed by PAT External Scientific Panel Members and contributions from other subject matter experts.
PCALION	Prostate Cancer Lifestyle Ontology	http://pcaontology.net/PCaLifeStyleDefault.aspx	PCLiON:Prostate Cancer Lifestyle Ontology
PCAO	Prostate Cancer Ontology	http://pcaontology.net	Prostate cancer ontology (PCaO) contains 637 concepts organized under three biological viewpoints, i.e., epidemiology, diagnosis, and treatment.
